wdid,name,pid,position
Q1557735,Guðlaugur Þór Þórðarson,Q55374777,Foreign Minister of Iceland
Q201075,Sigurður Ingi Jóhannsson,Q6865928,Minister for Nordic Cooperation
Q23753778,Lilja Dögg Alfreðsdóttir,Q12351697,"Minister of Education, Science and Culture"
Q879376,Bjarni Benediktsson,Q17278719,Minister of Finance
Q1789402,Kristján Þór Júlíusson,Q17278723,Minister of Fisheries and Agriculture
Q27988721,Áslaug Arna Sigurbjörnsdóttir,Q17013941,Minister of Justice and Ecclesiastical Affairs
Q467464,Katrín Jakobsdóttir,Q19190022,Prime Minister of Iceland
